{
  "id": "identity-service",
  "name": "identity-service",
  "type": "concrete",
  "version": "1.0.0",
  "description": "Identity and authentication service with Postgres and auth patterns",
  "tags": [
    "service",
    "identity",
    "auth",
    "postgres"
  ],
  "repo_types": [
    "go-service"
  ],
  "author": "SupplyChainGuard",
  "depends_on": [
    "scg-error",
    "scg-logger",
    "scg-validator",
    "scg-database"
  ],
  "provides": [
    "auth-handlers",
    "token-validation",
    "user-auth"
  ],
  "override_paths": [
    ".claude/CLAUDE.md#repo-specific-rules",
    ".claude/commands/custom.md"
  ]
}
